{
  "taskId": "live-omo-validation",
  "status": "failed",
  "summary": "OMO finished without writing the required result artifact.",
  "artifacts": {
    "handoff": "/home/molt/clawd/.tmp/openclaw-fabric-live-sandbox-20260415-070847-hephaestus/artifacts/live-handoff.md",
    "result": "/home/molt/clawd/.tmp/openclaw-fabric-live-sandbox-20260415-070847-hephaestus/artifacts/live-result.json"
  },
  "errors": [
    "Result artifact validation failed: ENOENT: no such file or directory, open '/home/molt/clawd/.tmp/openclaw-fabric-live-sandbox-20260415-070847-hephaestus/artifacts/live-result.json'",
    "openclaw/codex-gpt-54  \n  └─ \u001b[38;2;217;119;6m​​Hephaestus - Deep Agent\u001b[39m"
  ]
}
